{
  "$schema": "./config.schema.json",
  "tournament": {
    "name": "LLM Bot Tournament",
    "games_per_matchup": 1,
    "max_turns": 100,
    "map_pool_mode": "all",
    "should_reason": true,
    "log_conversations": true,
    "save_replays": true,
    "concurrent_games": 1,
    "llm_api_delay": 1.0
  },
  "output": {
    "results_dir": "/app/output/results",
    "conversation_log_dir": "/app/output/conversations",
    "replay_dir": "/app/output/replays"
  },
  "gcs": {
    "enabled": false,
    "bucket": "",
    "prefix": "tournaments/",
    "credentials_file": null
  },
  "maps": [
    {"path": "maps/1v1/beginner.csv", "max_turns": 50},
    {"path": "maps/1v1/funnel_point.csv", "max_turns": 75},
    {"path": "maps/1v1/center_mountains.csv", "max_turns": 100},
    {"path": "maps/1v1/corner_points.csv", "max_turns": 100}
  ],
  "bots": [
    {
      "name": "SimpleBot",
      "type": "simple"
    },
    {
      "name": "MediumBot",
      "type": "medium"
    },
    {
      "name": "AdvancedBot",
      "type": "advanced"
    },
    {
      "name": "Claude Opus 4.6",
      "type": "llm",
      "provider": "anthropic",
      "model": "claude-opus-4-6",
      "temperature": 0.5,
      "max_tokens": 16000
    },
    {
      "name": "Claude Haiku 4.5",
      "type": "llm",
      "provider": "anthropic",
      "model": "claude-haiku-4-5-20251001",
      "temperature": 0.5,
      "max_tokens": 12000
    },
    {
      "name": "Claude Sonnet 4.5",
      "type": "llm",
      "provider": "anthropic",
      "model": "claude-sonnet-4-5-20250929",
      "temperature": 0.5,
      "max_tokens": 12000
    },
    {
      "name": "GPT-4o Mini",
      "type": "llm",
      "provider": "openai",
      "model": "gpt-4o-mini",
      "temperature": 0.5,
      "max_tokens": 8000
    },
    {
      "name": "GPT-5.2",
      "type": "llm",
      "provider": "openai",
      "model": "gpt-5.2",
      "temperature": 0.5,
      "max_tokens": 16000
    },
    {
      "name": "Gemini 2.5 Flash",
      "type": "llm",
      "provider": "google",
      "model": "gemini-2.5-flash",
      "temperature": 0.5,
      "max_tokens": 8192
    },
    {
      "name": "Gemini 3 Flash",
      "type": "llm",
      "provider": "google",
      "model": "gemini-3-flash-preview",
      "temperature": 0.5,
      "max_tokens": 8192
    }
  ]
}
